{
  "client_name": "Clínica Veterinária Zenvet",
  "summary": "Brandbook da Clínica Veterinária Zenvet com 4 adjetivos de tom (Especialista · Humano · Transparente · Próximo), narrativa em 3 atos centrada na ansiedade da tutora de gato em decidir bem, e banco de copy de 30 headlines + 25 CTAs + 7 frases-chave + vocabulário com 12 termos a usar e 12 a evitar — tudo ancorado na PUV 'A clínica veterinária privada especialista em felinos de Americana — com medicina humana, acompanhamento pós-consulta e sem conta surpresa.' Diferencial verbal proprietário: combinação 'especialista sem arrogância + humano sem infantilização + transparente sem burocracia + próximo sem invasão' — traduz em linguagem aplicável a Louíse no WhatsApp e a Nathalia em conteúdo, sem deixar para 'sentido editorial'.",
  "summary_headline": "Brandbook Zenvet: 4 adjetivos de tom + narrativa em 3 atos centrada na Dra. Nathalia + copy bank com 30+ snippets prontos.",
  "summary_highlights": [
    {
      "category": "posicao",
      "label": "Adjetivos de tom",
      "value": "4",
      "subtext": "Especialista · Humano · Transparente · Próximo",
      "tone": "blue"
    },
    {
      "category": "maturidade",
      "label": "Narrativa",
      "value": "3 atos",
      "subtext": "Origem · Diferencial · Promessa",
      "tone": "green"
    },
    {
      "category": "oportunidade",
      "label": "Copy bank",
      "value": "30+ snippets",
      "subtext": "Prontos pra reuso em ads, lp, posts, GMB",
      "tone": "green"
    },
    {
      "category": "competicao",
      "label": "Identidade verbal",
      "value": "Diferenciada",
      "subtext": "Sem diminutivos pet, sem termos genéricos de mercado",
      "tone": "green"
    }
  ],
  "summary_key_findings": [
    {
      "category": "vantagem",
      "text": "4 adjetivos de tom dão à equipe um filtro deterministico para qualquer copy — reduz variância entre canais."
    },
    {
      "category": "contexto",
      "text": "Narrativa em 3 atos coloca Dra. Nathalia como protagonista — facilita reuso em entrevistas, depoimentos, conteúdo orgânico."
    },
    {
      "category": "acao",
      "text": "Copy bank deve ser fonte única para qualquer copy futura — reescrever do zero quebra coerência de marca."
    }
  ],
  "purpose": {
    "why_we_exist": "Existimos para que tutores de gato em Americana parem de aceitar atendimento veterinário genérico — porque cada gato esconde dor por instinto e merece uma profissional que enxergue isso antes que seja tarde, e cada tutora merece decidir com informação, não com susto.",
    "for_whom": "Para tutoras como a Mariana, que tratam o gato como filho da casa, pesquisam por dias antes de confiar e querem decidir com informação — não com susto. E para tutores como o Carlos, que querem hora marcada, sem fila e conta sem surpresa para cuidar do cachorro da família.",
    "not_for_whom": "Não somos para quem caça consulta isca de R$70 sem entender o que está incluído, para quem precisa de emergência 24h (direcionamos para parceiros), para quem quer um pet shop completo (banho, tosa, hotel), ou para quem chega com diagnóstico do Dr. Google e recusa orientação técnica.",
    "positioning": "Para tutoras de gatos de Americana, SBO e Nova Odessa que tratam o pet como filho da casa, a Zenvet é a clínica veterinária especialista em felinos que combina diagnóstico consultivo, ambiente preparado para gatos e acompanhamento ativo pós-consulta — porque a Dra. Nathalia tem formação felina declarada (pós-graduanda em clínica e cirurgia com ênfase em felinos) e a clínica foi estruturada para reduzir o estresse do gato em cada detalhe.",
    "promise": "Você sai daqui sabendo o que seu gato tem, com cada item da conta aprovado antes da execução e a Dra. Nathalia te acompanhando no WhatsApp depois — todas as vezes."
  },
  "verbal_identity": {
    "tone_adjectives": [
      {
        "adjective": "Especialista",
        "opposite": "arrogante",
        "explanation": "Nathalia explica conceitos de medicina felina sem jargão e sem condescendência. Em vez de 'o paciente apresenta hiporexia', diz 'ele está comendo menos — e isso costuma ser sinal de dor, porque gato esconde por instinto'. A autoridade vem da clareza, não da distância técnica."
      },
      {
        "adjective": "Humano",
        "opposite": "infantilizado",
        "explanation": "Chama o gato pelo nome real (Simba, não 'peludinho'), trata o tutor como adulto que decide (não como cliente que precisa ser agradado), e nunca usa diminutivos como 'castraçãozinha' ou 'consultinha'. Calor humano se manifesta em cuidado real (lembrar do nome, mandar mensagem D+1) — não em emoji ou apelido."
      },
      {
        "adjective": "Transparente",
        "opposite": "burocrático",
        "explanation": "Mostra o valor antes da execução, item a item, em linguagem direta. 'A consulta é R$ 220 e dura 40 min — o exame complementar X custa R$ 90 e indico se sair indício no físico'. Nunca 'sujeito a verificação no momento do atendimento' ou 'consultar tabela'. Transparência é palavra cumprida em microcopy, não em política impressa."
      },
      {
        "adjective": "Próximo",
        "opposite": "invasivo",
        "explanation": "WhatsApp é canal de cuidado da Nathalia — D+1 com pergunta aberta ('como o Simba está hoje?') e D+7 se for caso clínico que pediu retorno. Não é canal de promoção: nunca '10% off na próxima consulta!' em mensagem de acompanhamento. Frequência baixa, intencionalidade alta."
      }
    ],
    "writing_style": {
      "sentence_length": "Curtas a médias (8-18 palavras). Em conteúdo educativo, 1 ideia por frase. Em Reels, 1 frase por cena. Em LP e about, parágrafos respirados de no máximo 4 linhas — leitor que rola no celular não decifra muralha de texto.",
      "emoji_usage": "Uso parcimonioso. 🐱 e 🐾 OK em posts educativos felinos e na bio. Proibido cluster ('🐱❤️✨'), proibido 😍 🥰 e correlatos (infantilizam). Em comunicação de orçamento, agendamento ou clínica: zero emoji.",
      "humor_usage": "Humor leve apenas em conteúdo educativo de comportamento ('seu gato te ignora? bom sinal — ele se sente seguro'). Nunca em peças clínicas, em emergência, em atendimento via WhatsApp ou à custa de outros profissionais. Humor que não passa pelo crivo 'a Nathalia falaria isso?' não entra.",
      "technical_language": "Termo técnico sempre seguido de tradução em primeira menção: 'hiporexia (perda de apetite)'. Em peças para tutor já cliente (CRM avançado, retorno) pode usar termo direto. Em peças para tutor leigo (mídia paga, conteúdo top-of-funnel) traduz sempre.",
      "form_of_address": "Você. Nunca 'senhor/senhora' (cria distância e parece cobrança), nunca 'amigo/amiga' (informalidade demais e finge intimidade). 'Você' funciona com Mariana, Carlos e tutor mais velho.",
      "preferred_format": "Misto. Listas curtas (3-5 itens) para conteúdo educativo escaneável, parágrafos respirados em narrativa de marca, frases isoladas em criativos de tráfego. Bullet point com mais de 7 itens vira manual técnico — desmonta para 2 listas ou texto corrido.",
      "punctuation_style": "Ponto final firme. Travessão (—) para criar respiração e contraste. Reticências (...) e exclamação (!) usadas com extrema parcimônia: máximo 1 por peça e só quando há motivo emocional real (não decorativo). CAPS LOCK proibido em qualquer contexto. Itálico só para nome do paciente em narrativa ('o Simba voltou pra casa em 48h')."
    },
    "donts": [
      {
        "do": "A Dra. Nathalia tem formação em medicina felina e atende muito gato com esse perfil.",
        "dont": "Nossa Dra. é especialista em pets em geral!",
        "reason": "Especialização em felinos é o território proprietário (e a S2 levou um mês construindo). Generalizar para 'pets em geral' apaga o diferencial em 5 segundos e devolve a Zenvet para a categoria genérica que ela está justamente tentando deixar."
      },
      {
        "do": "Ele está comendo menos — pode ser sinal de dor, gato esconde por instinto. Vale uma consulta para investigar.",
        "dont": "Hiporexia em felinos exige investigação clínica imediata e eventual ultrassonografia abdominal.",
        "reason": "Tutor não é veterinário. Termo técnico sem tradução não cria autoridade — cria distância. Mariana fecha a aba ou pergunta no Google o que é hiporexia em vez de mandar mensagem para a clínica."
      },
      {
        "do": "A consulta especialista é R$ 220, dura 40 min e inclui acompanhamento pelo WhatsApp depois. Quer que eu agende?",
        "dont": "O valor da consulta é a partir de R$ 220, sujeito a verificação no momento do atendimento.",
        "reason": "Clareza absoluta de preço é uma das 3 promessas centrais do posicionamento. Linguagem com 'sujeito a' soa contratual e burocrática — quebra o tom transparente exatamente no momento decisivo (orçamento)."
      },
      {
        "do": "Como o Simba está hoje? Conseguiu comer alguma coisa?",
        "dont": "Olá! Tudo bem? Aproveite 10% off na próxima consulta!",
        "reason": "WhatsApp é canal de cuidado, não de vendas. Promoção genérica em D+1 quebra a confiança que o atendimento construiu — a tutora que recebeu 'comeu hoje?' se sente cuidada; a que recebeu '10% off' se sente cliente da farmácia."
      },
      {
        "do": "Atendemos cães também — com hora marcada, sem fila e valor explicado antes.",
        "dont": "Atendemos qualquer pet com excelência!",
        "reason": "Cães entram com o mesmo DNA de transparência, mas a comunicação não pode dizer 'qualquer pet' porque apaga o território felino sem trazer benefício de captura. Mensagem específica para Carlos preserva o posicionamento da Mariana."
      }
    ]
  },
  "brand_narrative": {